{
  "schema_version": "pf-core.event.v1",
  "event_id": "ev-file-read-denied",
  "event_kind": {
    "type": "action",
    "action": {
      "schema_version": "pf-core.action.v0",
      "principal": {
        "schema_version": "pf-core.principal.v0",
        "id": "agent-1",
        "tenant_id": "tenant-a",
        "roles": [
          "cap:file-read",
          "cap:email-send",
          "cap:handoff",
          "cap:mcp-invoke"
        ]
      },
      "capability": {
        "schema_version": "pf-core.capability.v0",
        "id": "cap:file-read",
        "effect_kind": "file.read",
        "resource_pattern": "/data/*"
      },
      "resource": {
        "schema_version": "pf-core.resource.v0",
        "uri": "/data/report.txt",
        "tenant_id": "tenant-b"
      },
      "effect": {
        "schema_version": "pf-core.effect.v0",
        "kind": "file.read"
      }
    }
  },
  "decision": "denied",
  "previous_event_hash": "0000000000000000000000000000000000000000000000000000000000000000",
  "event_hash": "b9fa5010e599df7e0802de826f592fc876e2076023306a3dd724956bf581ce84"
}
