{
  "schema_version": "pf-core.event.v1",
  "event_id": "ev-net-denied",
  "event_kind": {
    "type": "action",
    "action": {
      "schema_version": "pf-core.action.v0",
      "principal": {
        "schema_version": "pf-core.principal.v0",
        "id": "agent-1",
        "tenant_id": "tenant-a",
        "roles": [
          "cap:file-read",
          "cap:email-send"
        ]
      },
      "capability": {
        "schema_version": "pf-core.capability.v0",
        "id": "cap:network",
        "effect_kind": "network.egress",
        "resource_pattern": "*"
      },
      "resource": {
        "schema_version": "pf-core.resource.v0",
        "uri": "https://example.com",
        "tenant_id": "tenant-a"
      },
      "effect": {
        "schema_version": "pf-core.effect.v0",
        "kind": "network.egress"
      }
    }
  },
  "decision": "denied",
  "previous_event_hash": "0000000000000000000000000000000000000000000000000000000000000000",
  "event_hash": "4deb8c62e97d44e6b871cec972ce37e5e8c61bc67c7bc0590324ace27f77c9a1"
}
