{
  "schema_version": "pf-core.event.v1",
  "event_id": "ev-mcp-denied",
  "event_kind": {
    "type": "action",
    "action": {
      "schema_version": "pf-core.action.v0",
      "principal": {
        "schema_version": "pf-core.principal.v0",
        "id": "agent-1",
        "tenant_id": "tenant-a",
        "roles": [
          "cap:file-read",
          "cap:email-send"
        ]
      },
      "capability": {
        "schema_version": "pf-core.capability.v0",
        "id": "cap:mcp-invoke",
        "effect_kind": "mcp.invoke",
        "resource_pattern": "mcp:*"
      },
      "resource": {
        "schema_version": "pf-core.resource.v0",
        "uri": "mcp:network/fetch",
        "tenant_id": "tenant-a"
      },
      "effect": {
        "schema_version": "pf-core.effect.v0",
        "kind": "mcp.invoke"
      }
    }
  },
  "decision": "denied",
  "previous_event_hash": "0000000000000000000000000000000000000000000000000000000000000000",
  "event_hash": "b0038326643821ed887eae80411bfe2bbfe31bd158f8af61cbbad542f74a89ec"
}
